{
  "timeline": [
    {
      "date": "1985-11-01",
      "events": [
        {
          "date": "1985-11-01",
          "text": "Here, President Ronald Reagan drafts his 1985 inaugural address.",
          "source": "www.nytimes.com",
          "url": "https://www.nytimes.com/2025/11/14/us/trump-oval-office-study-merch.html",
          "title": "A Tiny West Wing Office Is Big on Trump Messaging"
        }
      ],
      "consensus": [],
      "conflict": [
        {
          "www.nytimes.com": [
            [
              "www.nytimes.com",
              "his 1985 inaugural address"
            ],
            [
              "www.nytimes.com",
              "president ronald reagan"
            ]
          ]
        }
      ],
      "importance": 1
    },
    {
      "date": "1989-11-01",
      "events": [
        {
          "date": "1989-11-01",
          "text": "In 1989, President George H.W. Bush spoke on the phone about the United States\u2019 invasion of Panama.",
          "source": "www.nytimes.com",
          "url": "https://www.nytimes.com/2025/11/14/us/trump-oval-office-study-merch.html",
          "title": "A Tiny West Wing Office Is Big on Trump Messaging"
        }
      ],
      "consensus": [],
      "conflict": [
        {
          "www.nytimes.com": [
            [
              "www.nytimes.com",
              "the united states\u2019 invasion"
            ],
            [
              "www.nytimes.com",
              "panama"
            ],
            [
              "www.nytimes.com",
              "the phone"
            ],
            [
              "www.nytimes.com",
              "president george h.w. bush"
            ]
          ]
        }
      ],
      "importance": 1
    },
    {
      "date": "2025-11-14",
      "events": [
        {
          "date": "2025-11-14",
          "text": "Archival photographs show presidents in the study undertaking the daily tasks of leading the free world .",
          "source": "www.nytimes.com",
          "url": "https://www.nytimes.com/2025/11/14/us/trump-oval-office-study-merch.html",
          "title": "A Tiny West Wing Office Is Big on Trump Messaging"
        },
        {
          "date": "2025-11-14",
          "text": "In the Trump era, the room has changed .",
          "source": "www.nytimes.com",
          "url": "https://www.nytimes.com/2025/11/14/us/trump-oval-office-study-merch.html",
          "title": "A Tiny West Wing Office Is Big on Trump Messaging"
        },
        {
          "date": "2025-11-14",
          "text": "Now, it looks almost like a miniature version of the gift shop at a Trump property .",
          "source": "www.nytimes.com",
          "url": "https://www.nytimes.com/2025/11/14/us/trump-oval-office-study-merch.html",
          "title": "A Tiny West Wing Office Is Big on Trump Messaging"
        },
        {
          "date": "2025-11-14",
          "text": "David Hume Kennerly/Getty Images This small, private room in the White House, known as the Oval Office study, has witnessed decades of history.",
          "source": "www.nytimes.com",
          "url": "https://www.nytimes.com/2025/11/14/us/trump-oval-office-study-merch.html",
          "title": "A Tiny West Wing Office Is Big on Trump Messaging"
        },
        {
          "date": "2025-11-14",
          "text": "Archival photographs show presidents in the study undertaking the daily tasks of leading the free world.",
          "source": "www.nytimes.com",
          "url": "https://www.nytimes.com/2025/11/14/us/trump-oval-office-study-merch.html",
          "title": "A Tiny West Wing Office Is Big on Trump Messaging"
        },
        {
          "date": "2025-11-14",
          "text": "Now, it looks almost like a miniature version of the gift shop at a Trump property.",
          "source": "www.nytimes.com",
          "url": "https://www.nytimes.com/2025/11/14/us/trump-oval-office-study-merch.html",
          "title": "A Tiny West Wing Office Is Big on Trump Messaging"
        },
        {
          "date": "2025-11-14",
          "text": "President Trump doesn\u2019t spend much time in the study working.",
          "source": "www.nytimes.com",
          "url": "https://www.nytimes.com/2025/11/14/us/trump-oval-office-study-merch.html",
          "title": "A Tiny West Wing Office Is Big on Trump Messaging"
        },
        {
          "date": "2025-11-14",
          "text": "But he takes foreign leaders there to show off the goods, including hats that reference a third term.",
          "source": "www.nytimes.com",
          "url": "https://www.nytimes.com/2025/11/14/us/trump-oval-office-study-merch.html",
          "title": "A Tiny West Wing Office Is Big on Trump Messaging"
        }
      ],
      "consensus": [],
      "conflict": [
        {
          "www.nytimes.com": [
            [
              "www.nytimes.com",
              "history"
            ],
            [
              "www.nytimes.com",
              "the daily tasks"
            ],
            [
              "www.nytimes.com",
              "a trump property"
            ],
            [
              "www.nytimes.com",
              "the free world"
            ],
            [
              "www.nytimes.com",
              "hats"
            ],
            [
              "www.nytimes.com",
              "foreign leaders"
            ],
            [
              "www.nytimes.com",
              "kennerly/getty images"
            ],
            [
              "www.nytimes.com",
              "that"
            ],
            [
              "www.nytimes.com",
              "the oval office study"
            ],
            [
              "www.nytimes.com",
              "david"
            ],
            [
              "www.nytimes.com",
              "much time"
            ],
            [
              "www.nytimes.com",
              "this small, private room"
            ],
            [
              "www.nytimes.com",
              "archival photographs"
            ],
            [
              "www.nytimes.com",
              "a miniature version"
            ],
            [
              "www.nytimes.com",
              "the study"
            ],
            [
              "www.nytimes.com",
              "the gift shop"
            ],
            [
              "www.nytimes.com",
              "presidents"
            ],
            [
              "www.nytimes.com",
              "a third term"
            ],
            [
              "www.nytimes.com",
              "the goods"
            ],
            [
              "www.nytimes.com",
              "the white house"
            ],
            [
              "www.nytimes.com",
              "decades"
            ],
            [
              "www.nytimes.com",
              "president trump"
            ],
            [
              "www.nytimes.com",
              "the room"
            ],
            [
              "www.nytimes.com",
              "the trump era"
            ]
          ]
        }
      ],
      "importance": 1
    }
  ],
  "combined_summary": " The Oval Office study, known as the Oval Office Study, has witnessed decades of history . In the Trump era, it looks almost like a miniature version of the gift shop at a Trump property . President Trump doesn't spend much time in the study working, but he takes foreign leaders there to show off the goods .",
  "story_reconstruction": "Headline:  The Oval Office study, known as the Oval Office Study, has witnessed decades of history . In the Trump era, it looks almost like a miniature version of the gift shop at a Trump property . President Trump doesn't spend much time in the study working, but he takes foreign leaders there to show off the goods .\n\n\nTimeline:\n- 1985-11-01: Here, President Ronald Reagan drafts his 1985 inaugural address.\n- 1989-11-01: In 1989, President George H.W. Bush spoke on the phone about the United States\u2019 invasion of Panama.\n- 2025-11-14: Archival photographs show presidents in the study undertaking the daily tasks of leading the free world .\n\nTurning points:\n- 1985-11-01 \u2014 Here, President Ronald Reagan drafts his 1985 inaugural address.\n- 1989-11-01 \u2014 In 1989, President George H.W. Bush spoke on the phone about the United States\u2019 invasion of Panama.\n- 2025-11-14 \u2014 Archival photographs show presidents in the study undertaking the daily tasks of leading the free world .\n\nConflicts (detected):\n- {'www.nytimes.com': [('www.nytimes.com', 'his 1985 inaugural address'), ('www.nytimes.com', 'president ronald reagan')]}\n- {'www.nytimes.com': [('www.nytimes.com', 'the united states\u2019 invasion'), ('www.nytimes.com', 'panama'), ('www.nytimes.com', 'the phone'), ('www.nytimes.com', 'president george h.w. bush')]}\n- {'www.nytimes.com': [('www.nytimes.com', 'history'), ('www.nytimes.com', 'the daily tasks'), ('www.nytimes.com', 'a trump property'), ('www.nytimes.com', 'the free world'), ('www.nytimes.com', 'hats'), ('www.nytimes.com', 'foreign leaders'), ('www.nytimes.com', 'kennerly/getty images'), ('www.nytimes.com', 'that'), ('www.nytimes.com', 'the oval office study'), ('www.nytimes.com', 'david'), ('www.nytimes.com', 'much time'), ('www.nytimes.com', 'this small, private room'), ('www.nytimes.com', 'archival photographs'), ('www.nytimes.com', 'a miniature version'), ('www.nytimes.com', 'the study'), ('www.nytimes.com', 'the gift shop'), ('www.nytimes.com', 'presidents'), ('www.nytimes.com', 'a third term'), ('www.nytimes.com', 'the goods'), ('www.nytimes.com', 'the white house'), ('www.nytimes.com', 'decades'), ('www.nytimes.com', 'president trump'), ('www.nytimes.com', 'the room'), ('www.nytimes.com', 'the trump era')]}\n\nJudge summary: Use caution \u2014 multiple sources with varying reliability. (Fallback mode)",
  "conflicting_claims": [],
  "bias_scores": {
    "https://www.nytimes.com/2025/11/14/us/trump-oval-office-study-merch.html": {
      "source": "www.nytimes.com",
      "title": "A Tiny West Wing Office Is Big on Trump Messaging",
      "clickbait_score": 0.0,
      "subjectivity": 0.0,
      "polarity_label": "NEGATIVE",
      "combined_bias": 0.0
    }
  },
  "sources": [
    "www.nytimes.com"
  ],
  "reliability": 0.3333333333333333,
  "articles_count": 1,
  "clusters": {
    "Cluster 1": [
      "Here, President Ronald Reagan drafts his 1985 inaugural address.",
      "In 1989, President George H.W. Bush spoke on the phone about the United States\u2019 invasion of Panama.",
      "In the Trump era, the room has changed .",
      "David Hume Kennerly/Getty Images This small, private room in the White House, known as the Oval Office study, has witnessed decades of history.",
      "President Trump doesn\u2019t spend much time in the study working.",
      "But he takes foreign leaders there to show off the goods, including hats that reference a third term."
    ],
    "Cluster 2": [
      "Archival photographs show presidents in the study undertaking the daily tasks of leading the free world .",
      "Archival photographs show presidents in the study undertaking the daily tasks of leading the free world."
    ],
    "Cluster 3": [
      "Now, it looks almost like a miniature version of the gift shop at a Trump property .",
      "Now, it looks almost like a miniature version of the gift shop at a Trump property."
    ]
  },
  "mermaid_gantt": "gantt\ndateFormat YYYY-MM-DD\ntitle Event Timeline\nsection 1985-11-01\nHere, President Ronald Re : 1985-11-01, 1d\nsection 1989-11-01\nIn 1989, President George : 1989-11-01, 1d\nsection 2025-11-14\nArchival photographs show : 2025-11-14, 1d\nIn the Trump era, the roo : 2025-11-14, 1d\nNow, it looks almost like : 2025-11-14, 1d\nDavid Hume Kennerly/Getty : 2025-11-14, 1d\nArchival photographs show : 2025-11-14, 1d\nNow, it looks almost like : 2025-11-14, 1d\nPresident Trump doesn\u2019t s : 2025-11-14, 1d\nBut he takes foreign lead : 2025-11-14, 1d",
  "_translated": true,
  "_translated_lang": "Tamil"
}